[
  {
    "case_id": "HV1-T01",
    "domain": "science_measurement",
    "routing_stratum": "TEST",
    "turns": [
      {
        "turn": 1,
        "agent_input": "A photometry team sees a repeatable 2.1% brightness dip in one target on three nights. Comparison stars on the same frames are stable. On all three nights the target landed on detector column 812 because the pointing was repeated. Historical flat-field residuals around that column are 1.5–2.5%. The event timing also matches the candidate orbital period. What conclusion is warranted now, and what should the team do next?"
      }
    ],
    "evaluator_key": {
      "observations": [
        "2.1% dip repeated on three nights",
        "comparison stars stable",
        "target on detector column 812 each night",
        "historical residuals near column 812 are of comparable magnitude",
        "timing matches candidate period"
      ],
      "not_observed": [
        "same target has not yet been measured off column 812 at the relevant phase",
        "no calibration sweep across column 812 from the same nights"
      ],
      "plausible_hypotheses": [
        "astrophysical transit",
        "detector-column response artifact",
        "interaction between source position and reduction"
      ],
      "discriminating_evidence": [
        "repeat the relevant phase with deliberate dithering off column 812",
        "measure a stable source or calibration illumination across column 812 under the same reduction"
      ],
      "decision_critical_uncertainties": [
        "whether the dip follows orbital phase when detector position changes"
      ],
      "constraints": [
        "limited telescope time: only one additional night before scheduling review"
      ],
      "acceptable_interventions": [
        "prioritize the observation that separates sky-fixed from detector-fixed explanations"
      ],
      "scoring_notes": [
        "Do not treat period agreement as decisive while detector position is perfectly confounded with event occurrence."
      ]
    },
    "design_metadata": {
      "sequential": false,
      "has_distractors": true,
      "requires_action": true,
      "freshness_attestation": "Not reused, paraphrased, or structurally cloned from v0.5-v0.11 development cases."
    }
  },
  {
    "case_id": "HV1-T02",
    "domain": "manufacturing",
    "routing_stratum": "TEST",
    "turns": [
      {
        "turn": 1,
        "agent_input": "A coating line’s blister reject rate rose from 0.7% to 4.8% this week. Three things changed within 24 hours: a new resin lot arrived, outside humidity increased sharply, and line 2’s oven zone B was recalibrated. Line 1 uses the same resin lot but a different oven and is at 1.0% rejects; line 2 runs mostly on the night shift when humidity is highest. What should operations conclude and do next?"
      }
    ],
    "evaluator_key": {
      "observations": [
        "rejects rose 0.7% to 4.8%",
        "new resin lot",
        "higher humidity",
        "oven zone B recalibrated",
        "line 1 same resin at 1.0%",
        "line 2 mostly runs during highest humidity"
      ],
      "not_observed": [
        "line 2 has not been run under low humidity since the increase",
        "oven profile has not been independently checked after recalibration"
      ],
      "plausible_hypotheses": [
        "humidity-driven moisture defect",
        "line 2 oven profile error",
        "resin-lot contribution interacting with line conditions"
      ],
      "discriminating_evidence": [
        "run a short matched line-2 production window under controlled low humidity while independently logging oven temperatures",
        "verify oven zone B against an independent reference before changing resin"
      ],
      "decision_critical_uncertainties": [
        "humidity and oven state remain partly confounded on line 2"
      ],
      "constraints": [
        "scrapping the resin lot would stop two lines and is costly"
      ],
      "acceptable_interventions": [
        "seek a matched comparison that changes one leading factor at a time"
      ],
      "scoring_notes": [
        "Same-resin performance on line 1 weakens a simple resin-only explanation but does not eliminate interaction effects."
      ]
    },
    "design_metadata": {
      "sequential": false,
      "has_distractors": true,
      "requires_action": true,
      "freshness_attestation": "Not reused, paraphrased, or structurally cloned from v0.5-v0.11 development cases."
    }
  },
  {
    "case_id": "HV1-T03",
    "domain": "public_services",
    "routing_stratum": "TEST",
    "turns": [
      {
        "turn": 1,
        "agent_input": "An online benefits application saw abandonment rise from 18% to 29% after a weekend release. The release included a new five-page form and a switch to a different SMS verification vendor. Analytics show most abandonment occurs before the verification screen, but event logging on the new form is incomplete for mobile users. Call-center reports also mention delayed verification codes. What should the program team infer at this point?"
      },
      {
        "turn": 2,
        "agent_input": "A later log repair shows mobile users who reached the verification screen abandoned at the old rate, while abandonment increased sharply on page 3 of the new form across both desktop and mobile. How should the team update its position?",
        "expected_revision": "The form flow becomes the leading explanation; verification delay should be demoted as the main cause while remaining a service issue."
      }
    ],
    "evaluator_key": {
      "observations": [
        "abandonment rose after two simultaneous changes",
        "early analytics placed many exits before verification",
        "mobile event logging initially incomplete",
        "call center reported code delays",
        "later repaired logs localize increase to page 3 across devices"
      ],
      "not_observed": [
        "causal reason for page-3 exits is not directly measured"
      ],
      "plausible_hypotheses": [
        "form-flow friction",
        "verification delay",
        "measurement artifact from incomplete logging"
      ],
      "discriminating_evidence": [
        "instrument page-level interactions and compare completion after a reversible page-3 simplification or matched traffic split"
      ],
      "decision_critical_uncertainties": [
        "which page-3 element causes the friction"
      ],
      "constraints": [
        "benefit access should not be disrupted by a broad rollback without evidence"
      ],
      "acceptable_interventions": [
        "narrowly address page-3 friction while separately monitoring verification service"
      ],
      "scoring_notes": [
        "The second turn should materially demote verification as the primary abandonment mechanism."
      ]
    },
    "design_metadata": {
      "sequential": true,
      "has_distractors": true,
      "requires_action": true,
      "freshness_attestation": "Not reused, paraphrased, or structurally cloned from v0.5-v0.11 development cases."
    }
  },
  {
    "case_id": "HV1-T04",
    "domain": "finance",
    "routing_stratum": "TEST",
    "turns": [
      {
        "turn": 1,
        "agent_input": "A market-neutral fund’s daily tracking error doubled after two operational changes: equity hedges began executing 20 minutes later, and the pricing pipeline started using a new close-price vendor for thinly traded bonds. The excess error is concentrated on days with large late-session equity moves and on days with illiquid-bond holdings. Either change could explain part of it. What should the risk team do before changing the strategy?"
      }
    ],
    "evaluator_key": {
      "observations": [
        "tracking error doubled",
        "hedges execute 20 minutes later",
        "new bond close-price vendor",
        "error clusters with late equity moves",
        "error also clusters with illiquid-bond exposure"
      ],
      "not_observed": [
        "true economic P&L under alternative bond marks is not yet reconciled",
        "counterfactual hedge timing has not been replayed"
      ],
      "plausible_hypotheses": [
        "late hedge timing creates real exposure",
        "new marks create apparent tracking error",
        "both contribute"
      ],
      "discriminating_evidence": [
        "replay hedge timing on historical intraday prices and separately recompute NAV with the prior/vendor-independent bond marks"
      ],
      "decision_critical_uncertainties": [
        "relative contribution of real exposure versus valuation noise"
      ],
      "constraints": [
        "strategy changes incur trading cost and mandate implications"
      ],
      "acceptable_interventions": [
        "separate economic exposure from measurement effects before altering portfolio construction"
      ],
      "scoring_notes": [
        "Do not collapse two independently plausible contributors into one."
      ]
    },
    "design_metadata": {
      "sequential": false,
      "has_distractors": true,
      "requires_action": true,
      "freshness_attestation": "Not reused, paraphrased, or structurally cloned from v0.5-v0.11 development cases."
    }
  },
  {
    "case_id": "HV1-T05",
    "domain": "logistics",
    "routing_stratum": "TEST",
    "turns": [
      {
        "turn": 1,
        "agent_input": "A cross-dock network’s missed-departure rate rose after a new pallet-slotting algorithm went live. In the same month, one major carrier changed its inbound appointment policy. Sites using the algorithm have more misses, but those sites also receive most freight from that carrier. What can be said now, and what evidence would be most useful?"
      },
      {
        "turn": 2,